{
  "type": "budget-profil",
  "version": 1,
  "exemple": true,
  "prenom": "Exemple",
  "initiales": "EX",
  "equipe": "Équipe exemple",
  "tresorier": {
    "nom": "Trésorier",
    "email": "tresorier@example.com"
  },
  "paie": {
    "taux": 12,
    "heuresPoste": 8,
    "heuresJournee": 8,
    "nuitMatin": 1,
    "nuitNuit": 7,
    "nuitSamNuit": 7,
    "majNuit": 0.25,
    "majSamMatin": 0.25,
    "majSamApm": 0.5,
    "majSamNuit": 1,
    "majFerie": 1,
    "primeEquipe": 2,
    "panierNuit": 4,
    "panierJour": 4,
    "transport": 1,
    "tx13e": 0.0833,
    "txIFM": 0.1,
    "txCP": 0.1,
    "txCotis": 0.22,
    "txExoHS": 0.11,
    "txCsgNonDed": 0.029,
    "pas": 0.02,
    "hs1Seuil": 35,
    "hs2Seuil": 43,
    "majHS1": 0.25,
    "majHS2": 0.5,
    "journeeNet": 90,
    "journeeBrut": 120
  },
  "tampon": 80,
  "fixes": [
    {
      "id": "loyer",
      "nom": "Loyer",
      "montant": 400,
      "jour": 5
    },
    {
      "id": "assurance",
      "nom": "Assurance",
      "montant": 30,
      "jour": 28
    },
    {
      "id": "forfait",
      "nom": "Forfait",
      "montant": 20,
      "jour": 15
    }
  ],
  "poches": [
    {
      "id": "courses",
      "nom": "Courses",
      "court": "Courses",
      "budget": 120,
      "jour": 11,
      "role": "depense"
    },
    {
      "id": "essence",
      "nom": "Essence",
      "court": "Essence",
      "budget": 50,
      "jour": 11,
      "role": "depense"
    },
    {
      "id": "restau",
      "nom": "Restau et pauses",
      "court": "Restau",
      "budget": 30,
      "jour": 11,
      "role": "depense"
    },
    {
      "id": "perso",
      "nom": "Perso",
      "court": "Perso",
      "budget": 25,
      "jour": 11,
      "role": "depense"
    },
    {
      "id": "voiture",
      "nom": "Voiture",
      "court": "Voiture",
      "budget": 20,
      "jour": 11,
      "role": "depense"
    },
    {
      "id": "vape",
      "nom": "Vape",
      "court": "Vape",
      "budget": 15,
      "jour": 11,
      "role": "depense"
    },
    {
      "id": "activites",
      "nom": "Activités",
      "court": "Activités",
      "budget": 20,
      "jour": 11,
      "role": "depense"
    },
    {
      "id": "filet",
      "nom": "Filet",
      "court": "Filet",
      "budget": 30,
      "jour": 11,
      "role": "reserve",
      "plafond": 150,
      "solde": 40
    },
    {
      "id": "amendes",
      "nom": "Amendes",
      "court": "Amendes",
      "budget": 0,
      "jour": 11,
      "role": "exception"
    }
  ],
  "objectifs": [
    {
      "id": "projet-a",
      "nom": "Projet A",
      "cible": 500,
      "mensuel": 40,
      "epargne": 180,
      "jour": 12
    },
    {
      "id": "projet-b",
      "nom": "Projet B",
      "cible": 900,
      "mensuel": 40,
      "epargne": 0,
      "jour": 12
    }
  ],
  "regles": [
    {
      "contient": "CAFE EXEMPLE",
      "poche": "perso"
    }
  ],
  "horaires": {
    "M": "5h-13h",
    "AM": "13h-21h",
    "N": "21h-5h",
    "J": "9h-17h"
  },
  "planning": {
    "2026-09-01": "AM",
    "2026-09-02": "M",
    "2026-09-03": "N",
    "2026-09-05": "AM",
    "2026-09-07": "M",
    "2026-09-08": "AM",
    "2026-09-09": "M",
    "2026-09-10": "N",
    "2026-09-12": "N",
    "2026-09-14": "M",
    "2026-09-15": "AM",
    "2026-09-16": "M",
    "2026-09-17": "N",
    "2026-09-19": "AM",
    "2026-09-21": "M",
    "2026-09-22": "AM",
    "2026-09-23": "M",
    "2026-09-24": "N",
    "2026-09-26": "N",
    "2026-09-28": "M",
    "2026-09-29": "AM",
    "2026-09-30": "M",
    "2026-10-01": "N",
    "2026-10-03": "AM",
    "2026-10-05": "M",
    "2026-10-06": "AM",
    "2026-10-07": "M",
    "2026-10-08": "N",
    "2026-10-10": "N",
    "2026-10-12": "M",
    "2026-10-13": "AM",
    "2026-10-14": "M",
    "2026-10-15": "N",
    "2026-10-17": "AM",
    "2026-10-19": "M",
    "2026-10-20": "AM",
    "2026-10-21": "M",
    "2026-10-22": "N",
    "2026-10-24": "N",
    "2026-10-26": "M",
    "2026-10-27": "AM",
    "2026-10-28": "M",
    "2026-10-29": "N",
    "2026-10-31": "AM",
    "2026-11-02": "M",
    "2026-11-03": "AM",
    "2026-11-04": "M",
    "2026-11-05": "N",
    "2026-11-07": "N",
    "2026-11-09": "M",
    "2026-11-10": "AM",
    "2026-11-11": "M",
    "2026-11-12": "N",
    "2026-11-14": "AM",
    "2026-11-16": "M",
    "2026-11-17": "AM",
    "2026-11-18": "M",
    "2026-11-19": "N",
    "2026-11-21": "N",
    "2026-11-23": "M",
    "2026-11-24": "AM",
    "2026-11-25": "M",
    "2026-11-26": "N",
    "2026-11-28": "AM",
    "2026-11-30": "M",
    "2026-12-01": "AM",
    "2026-12-02": "M",
    "2026-12-03": "N",
    "2026-12-05": "N",
    "2026-12-07": "M",
    "2026-12-08": "AM",
    "2026-12-09": "M",
    "2026-12-10": "N",
    "2026-12-12": "AM",
    "2026-12-14": "M",
    "2026-12-15": "AM",
    "2026-12-16": "M",
    "2026-12-17": "N",
    "2026-12-19": "N",
    "2026-12-21": "M",
    "2026-12-22": "AM",
    "2026-12-23": "M",
    "2026-12-24": "N",
    "2026-12-26": "AM",
    "2026-12-28": "M",
    "2026-12-29": "AM",
    "2026-12-30": "M",
    "2026-12-31": "N",
    "2026-10-16": "J",
    "2026-11-20": "J",
    "2026-12-11": "J"
  }
}
